MCQ,Choices,Correct
What term was coined in 1959 by Arthur Samuel to describe the field of computer gaming and artificial intelligence?,a: Self-teaching computers | b: Machine learning | c: Neural networks | d: Reinforcement learning,b
"Who published the book 'The Organization of Behavior' in 1949, introducing a theoretical neural structure?",a: Arthur Samuel | b: Donald Hebb | c: Tom M. Mitchell | d: Walter Pitts,b
Which company developed an experimental 'learning machine' called Cybertron in the early 1960s?,a: IBM | b: Raytheon Company | c: Google | d: Microsoft,b
"According to Tom M. Mitchell, what is the definition of a computer program learning from experience?",a: Improving performance based on experience | b: Recognizing patterns | c: Classifying data | d: Making predictions,a
What are the two objectives of modern-day machine learning mentioned in the text?,a: Recognizing patterns and making predictions | b: Classifying data and developing models | c: Training neural networks and using reinforcement learning | d: Analyzing sonar signals and speech patterns,b
